{
  "name": "Ember",
  "version": "1.0.0",
  "author": "you",
  "description": "Fire dragon, snarky",
  "personality": "Generated via NekoForge — fill in your own personality string before shipping.",
  "system_prompt": "You are Ember, an AI desktop pet living on the user's screen. You are short-spoken, warm, occasionally curious. Use 1-2 sentences max unless asked. Never use markdown.",
  "spritesDir": "sprites",
  "animations": {
    "idle": {
      "files": ["idle1.png", "idle2.png", "idle3.png", "idle4.png"],
      "fps": 3,
      "loop": true
    },
    "walk_right": {
      "files": ["walk_right1.png", "walk_right2.png", "walk_right3.png", "walk_right4.png"],
      "fps": 8,
      "loop": true
    },
    "walk_left": {
      "files": ["walk_left1.png", "walk_left2.png", "walk_left3.png", "walk_left4.png"],
      "fps": 8,
      "loop": true
    },
    "walk_up": {
      "files": ["walk_up1.png", "walk_up2.png"],
      "fps": 8,
      "loop": true
    },
    "walk_down": {
      "files": ["walk_down1.png", "walk_down2.png"],
      "fps": 8,
      "loop": true
    },
    "walk_up_right": {
      "files": ["walk_up_right1.png", "walk_up_right2.png"],
      "fps": 8,
      "loop": true
    },
    "walk_up_left": {
      "files": ["walk_up_left1.png", "walk_up_left2.png"],
      "fps": 8,
      "loop": true
    },
    "walk_down_right": {
      "files": ["walk_down_right1.png", "walk_down_right2.png"],
      "fps": 8,
      "loop": true
    },
    "walk_down_left": {
      "files": ["walk_down_left1.png", "walk_down_left2.png"],
      "fps": 8,
      "loop": true
    },
    "alert": {
      "files": ["alert1.png", "alert2.png"],
      "fps": 4,
      "loop": false
    },
    "sleep": {
      "files": ["sleep1.png", "sleep2.png"],
      "fps": 2,
      "loop": true
    },
    "yawn": {
      "files": ["yawn1.png", "yawn2.png"],
      "fps": 3,
      "loop": false
    },
    "falling_asleep": {
      "files": ["falling_asleep1.png", "falling_asleep2.png", "falling_asleep3.png"],
      "fps": 3,
      "loop": false
    },
    "awaken": {
      "files": ["awaken1.png", "awaken2.png", "awaken3.png"],
      "fps": 6,
      "loop": false
    },
    "happy": {
      "files": ["happy1.png", "happy2.png", "happy3.png"],
      "fps": 6,
      "loop": false
    },
    "playing": {
      "files": ["playing1.png", "playing2.png"],
      "fps": 6,
      "loop": true
    },
    "hunting": {
      "files": ["hunting1.png", "hunting2.png"],
      "fps": 5,
      "loop": true
    },
    "bored": {
      "files": ["bored1.png", "bored2.png"],
      "fps": 2,
      "loop": true
    },
    "studying": {
      "files": ["studying1.png", "studying2.png"],
      "fps": 3,
      "loop": true
    }
  },
  "triggers": {
    "on_cursor_near": "happy",
    "on_chat_open": "awaken",
    "on_idle_3min": "yawn",
    "on_idle_5min": "falling_asleep",
    "on_idle_6min": "sleep",
    "on_movement_start": "awaken"
  }
}
